{
  "captured_at": "2026-10-19T01:05:48.764548+00:00",
  "cleanup": {
    "reason": "persistent_assignment_requested",
    "status": "NOT_APPLICABLE"
  },
  "credential_digest": "sha256:b27033322a421fcdbf7c8a2f5347a34715a37b1798c3bda1cf1dd39e781909a3",
  "credential_source": "file:path:29f247d18d3c",
  "errors": [],
  "execution_host": "mac.lan",
  "identity": {
    "id": 6,
    "username": "spyroot",
    "web_url": "https://gitlab.dcloud.run/spyroot"
  },
  "kind": "gitlab_runner",
  "mutated": true,
  "operation": "assign",
  "origin": "https://gitlab.dcloud.run",
  "phase": "APPLY",
  "plan": {
    "body_sha256": "44136fa355b3678a1146ad16f7e8649e94fb4fc21fe77e8310c060f61caaff8a",
    "confirmation_ready": true,
    "fields": [],
    "one_time_sink_required": false,
    "operation": "assign",
    "plan_digest": "5caefb85328f78a664db7e65c332411508c260256be6e80332ba656380cce279",
    "project_ids": null,
    "resource_id": 97,
    "target_kind": "project",
    "target_reference": "hott/ci-skills-runner-proof"
  },
  "plan_digest": "5caefb85328f78a664db7e65c332411508c260256be6e80332ba656380cce279",
  "readback": {
    "action": "APPLIED",
    "cleanup": {
      "reason": "persistent_assignment_requested",
      "status": "NOT_APPLICABLE"
    },
    "errors": [],
    "id": 97,
    "mutated": true,
    "projects": [
      {
        "action": "APPLIED",
        "project_id": 124,
        "verified": true
      }
    ],
    "verified": true
  },
  "records": [
    {
      "action": "APPLIED",
      "cleanup": {
        "reason": "persistent_assignment_requested",
        "status": "NOT_APPLICABLE"
      },
      "errors": [],
      "id": 97,
      "mutated": true,
      "projects": [
        {
          "action": "APPLIED",
          "project_id": 124,
          "verified": true
        }
      ],
      "verified": true
    }
  ],
  "result_action": "APPLIED",
  "schema_version": "1.0",
  "skill": {
    "algorithm": "sha256-tree-v1",
    "consuming_project": {
      "commit": null,
      "source": null
    },
    "digest": "ac13183ffd71563eabf7676f6b2da8cb17042667ea951fa9adbab20b513b7e60",
    "file_count": 227,
    "functional_digest": "0336a2806847e9e9cb75e962c72ea568864e1df50e0039efaad4f84c33d4cced",
    "revision": {
      "source": "installer_record",
      "value": "d2a16beab957f5b5ef34c2ae0e22b36f638e53e3",
      "verified": true
    }
  },
  "status": "PASS",
  "summary": {
    "error_count": 0,
    "record_count": 1
  },
  "target": {
    "kind": "project",
    "reference": "hott/ci-skills-runner-proof"
  },
  "target_file": "path:9f3098ba4860",
  "target_source": "project;argv:--project",
  "tested_revision": "d2a16beab957f5b5ef34c2ae0e22b36f638e53e3",
  "verified_target": {
    "full_path": "hott/ci-skills-runner-proof",
    "id": 124,
    "kind": "project",
    "web_url": "https://gitlab.dcloud.run/hott/ci-skills-runner-proof"
  }
}
