{
  "captured_at": "2026-10-18T02:03:53.063478+00:00",
  "cleanup": {
    "status": "NOT_APPLICABLE"
  },
  "credential_digest": "sha256:b27033322a421fcdbf7c8a2f5347a34715a37b1798c3bda1cf1dd39e781909a3",
  "credential_source": "file:path:29f247d18d3c",
  "errors": [],
  "execution_host": "mac.lan",
  "identity": {
    "id": 6,
    "username": "spyroot",
    "web_url": "https://gitlab.dcloud.run/spyroot"
  },
  "kind": "gitlab_issue",
  "mutated": true,
  "operation": "open-bug",
  "origin": "https://gitlab.dcloud.run",
  "phase": "APPLY",
  "plan": {
    "body_sha256": "bb86f347e9dc8e1eb40e429fcb685b9bbf1be9b21d54d46d16cae62f9322b057",
    "confirmation_ready": true,
    "fields": [
      "description",
      "title"
    ],
    "one_time_sink_required": false,
    "operation": "open-bug",
    "plan_digest": "16891eb389580a8ed12592cbbe0f9dc040773a09d43075490bbe39eac3605b8e",
    "project_ids": null,
    "resource_id": null,
    "target_kind": "project",
    "target_reference": "hott/test"
  },
  "plan_digest": "16891eb389580a8ed12592cbbe0f9dc040773a09d43075490bbe39eac3605b8e",
  "readback": {
    "action": "APPLIED",
    "iid": 16,
    "verified": true,
    "web_url": "https://gitlab.dcloud.run/hott/test/-/issues/16"
  },
  "records": [
    {
      "action": "APPLIED",
      "iid": 16,
      "verified": true,
      "web_url": "https://gitlab.dcloud.run/hott/test/-/issues/16"
    }
  ],
  "result_action": "APPLIED",
  "schema_version": "1.0",
  "skill": {
    "algorithm": "sha256-tree-v1",
    "consuming_project": {
      "commit": null,
      "source": null
    },
    "digest": "1cb30887851e9edb58fbb0d08c9679d8dd736d82314b53bf1c7aff5e33ef6cc3",
    "file_count": 159,
    "functional_digest": "1bd593cf493b854d921cb2d08eea333d6f08c3f3033fa474e09f28e921c1e052",
    "revision": {
      "source": "installer_record",
      "value": "9aa288084328a9c44d38d78bd86b5e8785d810b3",
      "verified": true
    }
  },
  "status": "PASS",
  "summary": {
    "error_count": 0,
    "record_count": 1
  },
  "target": {
    "kind": "project",
    "reference": "hott/test"
  },
  "target_file": "path:aef5c479ccee",
  "target_source": "project;argv:--project",
  "tested_revision": "9aa288084328a9c44d38d78bd86b5e8785d810b3",
  "verified_target": {
    "full_path": "hott/test",
    "id": 123,
    "kind": "project",
    "web_url": "https://gitlab.dcloud.run/hott/test"
  }
}
