{
  "captured_at": "2026-10-18T14:05:00.179690+00:00",
  "cleanup": {
    "status": "NOT_APPLICABLE"
  },
  "credential_digest": "sha256:b27033322a421fcdbf7c8a2f5347a34715a37b1798c3bda1cf1dd39e781909a3",
  "credential_source": "file:path:29f247d18d3c",
  "errors": [],
  "execution_host": "mac.lan",
  "identity": {
    "id": 6,
    "username": "spyroot",
    "web_url": "https://gitlab.dcloud.run/spyroot"
  },
  "kind": "gitlab_issue",
  "mutated": false,
  "operation": "open-bug",
  "origin": "https://gitlab.dcloud.run",
  "phase": "APPLY",
  "plan": {
    "body_sha256": "3772dff7309269826b8d2f47151c562f36e207c5613f3391663dffe481e66955",
    "confirmation_ready": true,
    "fields": [
      "description",
      "title"
    ],
    "one_time_sink_required": false,
    "operation": "open-bug",
    "plan_digest": "986cec919282346424acaff319c5b631e23e3a5063d8177e87ff9c992292ebfa",
    "project_ids": null,
    "resource_id": null,
    "target_kind": "project",
    "target_reference": "hott/test"
  },
  "plan_digest": "986cec919282346424acaff319c5b631e23e3a5063d8177e87ff9c992292ebfa",
  "readback": {
    "action": "NO_OP",
    "iid": 26,
    "verified": true
  },
  "records": [
    {
      "action": "NO_OP",
      "iid": 26,
      "verified": true
    }
  ],
  "result_action": "NO_OP",
  "schema_version": "1.0",
  "skill": {
    "algorithm": "sha256-tree-v1",
    "consuming_project": {
      "commit": null,
      "source": null
    },
    "digest": "0d343fe1d4c8dc6bda5172f572306f6e1f2b50dfdf0d6b0a0d5938a624fab0a8",
    "file_count": 207,
    "functional_digest": "5c8a13b2c648a054c1988092cb72af4dff6b6c6c1394d3de4692ee51709e6b9a",
    "revision": {
      "source": "installer_record",
      "value": "d8ab14b2d4d408975bc378ce871737bd014bbe44",
      "verified": true
    }
  },
  "status": "PASS",
  "summary": {
    "error_count": 0,
    "record_count": 1
  },
  "target": {
    "kind": "project",
    "reference": "hott/test"
  },
  "target_file": "path:331790f9f63b",
  "target_source": "project;argv:--project",
  "tested_revision": "d8ab14b2d4d408975bc378ce871737bd014bbe44",
  "verified_target": {
    "full_path": "hott/test",
    "id": 123,
    "kind": "project",
    "web_url": "https://gitlab.dcloud.run/hott/test"
  }
}
