{
  "captured_at": "2026-10-18T21:50:51.323594+00:00",
  "cleanup": {
    "status": "NOT_APPLICABLE"
  },
  "credential_digest": "sha256:b27033322a421fcdbf7c8a2f5347a34715a37b1798c3bda1cf1dd39e781909a3",
  "credential_source": "file:path:29f247d18d3c",
  "errors": [],
  "execution_host": "mac.lan",
  "identity": {
    "id": 6,
    "username": "spyroot",
    "web_url": "https://gitlab.dcloud.run/spyroot"
  },
  "kind": "gitlab_pipeline",
  "mutated": false,
  "operation": "start",
  "origin": "https://gitlab.dcloud.run",
  "phase": "APPLY",
  "plan": {
    "body_sha256": "8e6782c939cde5fd97aa9daaa891ae640c6092bba08de936a82f2c8efa5998ac",
    "confirmation_ready": true,
    "fields": [
      "expected_sha",
      "protected_ref",
      "ref",
      "requested_ref",
      "require_protected_ref",
      "resolved_sha",
      "run_id",
      "variables"
    ],
    "one_time_sink_required": false,
    "operation": "start",
    "plan_digest": "91f7eb331797810c4982d3006515cfcc5cd70f058f85c4243d14c503481f1478",
    "project_ids": null,
    "resource_id": null,
    "target_kind": "project",
    "target_reference": "hott/test"
  },
  "plan_digest": "91f7eb331797810c4982d3006515cfcc5cd70f058f85c4243d14c503481f1478",
  "readback": {
    "action": "NO_OP",
    "after": {
      "id": 3927,
      "project_id": 123,
      "ref": "neroshige/ci-skills-job-list-smoke-20261007",
      "sha": "a9cd22f5a66395f9514102356ba8dd3e3573af5e",
      "status": "success"
    },
    "cleanup": {
      "status": "NOT_APPLICABLE"
    },
    "errors": [],
    "id": 3927,
    "mutated": false,
    "ref": "neroshige/ci-skills-job-list-smoke-20261007",
    "sha": "a9cd22f5a66395f9514102356ba8dd3e3573af5e",
    "status": "success",
    "verified": true
  },
  "records": [
    {
      "action": "NO_OP",
      "after": {
        "id": 3927,
        "project_id": 123,
        "ref": "neroshige/ci-skills-job-list-smoke-20261007",
        "sha": "a9cd22f5a66395f9514102356ba8dd3e3573af5e",
        "status": "success"
      },
      "cleanup": {
        "status": "NOT_APPLICABLE"
      },
      "errors": [],
      "id": 3927,
      "mutated": false,
      "ref": "neroshige/ci-skills-job-list-smoke-20261007",
      "sha": "a9cd22f5a66395f9514102356ba8dd3e3573af5e",
      "status": "success",
      "verified": true
    }
  ],
  "result_action": "NO_OP",
  "schema_version": "1.0",
  "skill": {
    "algorithm": "sha256-tree-v1",
    "consuming_project": {
      "commit": null,
      "source": null
    },
    "digest": "a034ab750654ed12a5eaffad51e5f48ef4aac8e99984aa7f601b69c9c8337631",
    "file_count": 218,
    "functional_digest": "9e28e57e6fbf4ea4e3de0ad155fd2d95bf2353bd7eb1503814ea9e81f301c07e",
    "revision": {
      "source": "installer_record",
      "value": "d1b2c6fb4e47836a68140873c220935463ebff81",
      "verified": true
    }
  },
  "status": "PASS",
  "summary": {
    "error_count": 0,
    "record_count": 1
  },
  "target": {
    "kind": "project",
    "reference": "hott/test"
  },
  "target_file": "path:d6e4cdad550e",
  "target_source": "project;argv:--project",
  "tested_revision": "d1b2c6fb4e47836a68140873c220935463ebff81",
  "verified_target": {
    "full_path": "hott/test",
    "id": 123,
    "kind": "project",
    "web_url": "https://gitlab.dcloud.run/hott/test"
  }
}
