{
  "captured_at": "2026-10-20T01:59:40.890390+00:00",
  "cleanup": {
    "status": "NOT_APPLICABLE"
  },
  "credential_digest": "sha256:b27033322a421fcdbf7c8a2f5347a34715a37b1798c3bda1cf1dd39e781909a3",
  "credential_source": "file:path:29f247d18d3c",
  "errors": [],
  "execution_host": "mac.lan",
  "identity": {
    "id": 6,
    "username": "spyroot",
    "web_url": "https://gitlab.dcloud.run/spyroot"
  },
  "kind": "gitlab_merge_request",
  "mutated": true,
  "operation": "update",
  "origin": "https://gitlab.dcloud.run",
  "phase": "APPLY",
  "plan": {
    "body_sha256": "92759484d9c46545fc62753a084474fef4eb498c6f2f6d1437805c84270f7fcd",
    "confirmation_ready": true,
    "fields": [
      "milestone_id"
    ],
    "one_time_sink_required": false,
    "operation": "update",
    "plan_digest": "3dd0f620a4fb29f1b7cfd2dab211cbcb800c620ad581347b3a7fe8d3ba817474",
    "project_ids": null,
    "resource_id": 1,
    "target_kind": "project",
    "target_reference": "123"
  },
  "plan_digest": "3dd0f620a4fb29f1b7cfd2dab211cbcb800c620ad581347b3a7fe8d3ba817474",
  "readback": {
    "action": "APPLIED",
    "id": 549,
    "iid": 1,
    "milestone_id": 113,
    "title": "Add Go hello-world consumer example",
    "verified": true
  },
  "records": [
    {
      "action": "APPLIED",
      "id": 549,
      "iid": 1,
      "milestone_id": 113,
      "title": "Add Go hello-world consumer example",
      "verified": true
    }
  ],
  "result_action": "APPLIED",
  "schema_version": "1.0",
  "skill": {
    "algorithm": "sha256-tree-v1",
    "consuming_project": {
      "commit": null,
      "source": null
    },
    "digest": "7194c1819ad07de0b5046e14614a32bd1e50cf71021a9cc05ecb43aeabbb1001",
    "file_count": 241,
    "functional_digest": "7a3f5b60d17c89c26f845009b7afa68ffa9e81ffb13dd8bc8a6fdb9b71d611e8",
    "revision": {
      "source": "installer_record",
      "value": "39bbf4a10e16d0f51407b67d655dc3746219b087",
      "verified": true
    }
  },
  "status": "PASS",
  "summary": {
    "error_count": 0,
    "record_count": 1
  },
  "target": {
    "kind": "project",
    "reference": "123"
  },
  "target_file": "path:5e5380df1eda",
  "target_source": "user;argv:--project",
  "tested_revision": "39bbf4a10e16d0f51407b67d655dc3746219b087",
  "verified_target": {
    "full_path": "hott/test",
    "id": 123,
    "kind": "project",
    "web_url": "https://gitlab.dcloud.run/hott/test"
  }
}
