{
  "captured_at": "2026-10-03T23:14:31.930616+00:00",
  "cleanup": {
    "status": "NOT_APPLICABLE"
  },
  "credential_digest": "sha256:b27033322a421fcdbf7c8a2f5347a34715a37b1798c3bda1cf1dd39e781909a3",
  "credential_source": "file:path:2ccda27d0866",
  "errors": [],
  "execution_host": "mac.lan",
  "identity": {
    "id": 6,
    "username": "spyroot",
    "web_url": "https://gitlab.dcloud.run/spyroot"
  },
  "kind": "gitlab_wiki",
  "mutated": true,
  "operation": "update",
  "origin": "https://gitlab.dcloud.run",
  "phase": "APPLY",
  "plan": {
    "body_sha256": "d2bad96d3790d72fa6deeb2979f5834bfdfbdc48f9fb16fbca0a997a183959cc",
    "confirmation_ready": true,
    "fields": [
      "content"
    ],
    "one_time_sink_required": false,
    "operation": "update",
    "plan_digest": "ce73f7f9b2df48cf157f75e90ee5c4ec15a6c4bf7fce86809e254846aada442c",
    "project_ids": null,
    "resource_id": "HOTT-team-ci-skills-PR16-4a57607-wiki-20261003",
    "target_kind": "project",
    "target_reference": "hott/test"
  },
  "plan_digest": "ce73f7f9b2df48cf157f75e90ee5c4ec15a6c4bf7fce86809e254846aada442c",
  "readback": {
    "action": "APPLIED",
    "slug": "HOTT-team-ci-skills-PR16-4a57607-wiki-20261003",
    "verified": true
  },
  "records": [
    {
      "action": "APPLIED",
      "slug": "HOTT-team-ci-skills-PR16-4a57607-wiki-20261003",
      "verified": true
    }
  ],
  "result_action": "APPLIED",
  "schema_version": "1.0",
  "skill": {
    "algorithm": "sha256-tree-v1",
    "consuming_project": {
      "commit": null,
      "source": null
    },
    "digest": "86f7aa4c5f9574e01e65b9216fc2d6f9e9db5169360ab206affbabf243f8cf98",
    "file_count": 48,
    "revision": {
      "source": "git_head",
      "value": "4a576077ed44adf8c352b789ae41321c906beeb2",
      "verified": true
    }
  },
  "status": "PASS",
  "summary": {
    "error_count": 0,
    "record_count": 1
  },
  "target": {
    "kind": "project",
    "reference": "hott/test"
  },
  "target_file": "path:5e5380df1eda",
  "target_source": "user;argv:--project",
  "tested_revision": null,
  "verified_target": {
    "full_path": "hott/test",
    "id": 123,
    "kind": "project",
    "web_url": "https://gitlab.dcloud.run/hott/test"
  }
}
