{
  "captured_at": "2026-10-18T14:05:23.203382+00:00",
  "cleanup": {
    "status": "NOT_APPLICABLE"
  },
  "credential_digest": "sha256:b27033322a421fcdbf7c8a2f5347a34715a37b1798c3bda1cf1dd39e781909a3",
  "credential_source": "file:path:29f247d18d3c",
  "errors": [],
  "execution_host": "mac.lan",
  "identity": {
    "id": 6,
    "username": "spyroot",
    "web_url": "https://gitlab.dcloud.run/spyroot"
  },
  "kind": "gitlab_wiki",
  "mutated": true,
  "operation": "update",
  "origin": "https://gitlab.dcloud.run",
  "phase": "APPLY",
  "plan": {
    "body_sha256": "cf0d35e8eaa95b197ff92b268ed5d081a3f0905308b21c0510c879cae2f64342",
    "confirmation_ready": true,
    "fields": [
      "content"
    ],
    "one_time_sink_required": false,
    "operation": "update",
    "plan_digest": "192e33a34437435bfab2b3123bdfc4b68b076c88d440ce84031648873552944f",
    "project_ids": null,
    "resource_id": "ci-skills-d8ab14b2-20261018T140252Z",
    "target_kind": "project",
    "target_reference": "hott/test"
  },
  "plan_digest": "192e33a34437435bfab2b3123bdfc4b68b076c88d440ce84031648873552944f",
  "readback": {
    "action": "APPLIED",
    "slug": "ci-skills-d8ab14b2-20261018T140252Z",
    "verified": true
  },
  "records": [
    {
      "action": "APPLIED",
      "slug": "ci-skills-d8ab14b2-20261018T140252Z",
      "verified": true
    }
  ],
  "result_action": "APPLIED",
  "schema_version": "1.0",
  "skill": {
    "algorithm": "sha256-tree-v1",
    "consuming_project": {
      "commit": null,
      "source": null
    },
    "digest": "0d343fe1d4c8dc6bda5172f572306f6e1f2b50dfdf0d6b0a0d5938a624fab0a8",
    "file_count": 207,
    "functional_digest": "5c8a13b2c648a054c1988092cb72af4dff6b6c6c1394d3de4692ee51709e6b9a",
    "revision": {
      "source": "installer_record",
      "value": "d8ab14b2d4d408975bc378ce871737bd014bbe44",
      "verified": true
    }
  },
  "status": "PASS",
  "summary": {
    "error_count": 0,
    "record_count": 1
  },
  "target": {
    "kind": "project",
    "reference": "hott/test"
  },
  "target_file": "path:331790f9f63b",
  "target_source": "project;argv:--project",
  "tested_revision": "d8ab14b2d4d408975bc378ce871737bd014bbe44",
  "verified_target": {
    "full_path": "hott/test",
    "id": 123,
    "kind": "project",
    "web_url": "https://gitlab.dcloud.run/hott/test"
  }
}
