{
  "captured_at": "2026-10-17T21:07:48.745311+00:00",
  "cleanup": {
    "status": "NOT_APPLICABLE"
  },
  "credential_digest": "sha256:b27033322a421fcdbf7c8a2f5347a34715a37b1798c3bda1cf1dd39e781909a3",
  "credential_source": "file:path:29f247d18d3c",
  "errors": [],
  "execution_host": "mac.lan",
  "identity": {
    "id": 6,
    "username": "spyroot",
    "web_url": "https://gitlab.dcloud.run/spyroot"
  },
  "kind": "gitlab_milestone",
  "mutated": false,
  "operation": "adjust-time",
  "origin": "https://gitlab.dcloud.run",
  "phase": "APPLY",
  "plan": {
    "body_sha256": "4d4f79a6db4e336c7fa38ca33f4beaf37c3b5e4db57ae7fbe81d457b3dc2e7a2",
    "confirmation_ready": true,
    "fields": [
      "due_date",
      "start_date"
    ],
    "one_time_sink_required": false,
    "operation": "adjust-time",
    "plan_digest": "85dfe6930b4908c28b9d0c52c318df9efeff533ed7d124d262224f544d670d01",
    "project_ids": null,
    "resource_id": 90,
    "target_kind": "project",
    "target_reference": "hott/test"
  },
  "plan_digest": "85dfe6930b4908c28b9d0c52c318df9efeff533ed7d124d262224f544d670d01",
  "readback": {
    "action": "NO_OP",
    "id": 90,
    "verified": true
  },
  "records": [
    {
      "action": "NO_OP",
      "id": 90,
      "verified": true
    }
  ],
  "result_action": "NO_OP",
  "schema_version": "1.0",
  "skill": {
    "algorithm": "sha256-tree-v1",
    "consuming_project": {
      "commit": null,
      "source": null
    },
    "digest": "7e5cf3950d5c5d80b8193e650734899c678703b3e129af8f284196553353a8da",
    "file_count": 159,
    "functional_digest": "a1f62f687d0e8c6392abe1412cbaa10abc03a03815471f55df3b49b56e425fd8",
    "revision": {
      "source": "installer_record",
      "value": "9fe0fea86d224a58f0b86011a39af1297334f647",
      "verified": true
    }
  },
  "status": "PASS",
  "summary": {
    "error_count": 0,
    "record_count": 1
  },
  "target": {
    "kind": "project",
    "reference": "hott/test"
  },
  "target_file": "path:d5d66d4789c0",
  "target_source": "project;argv:--project",
  "tested_revision": "9fe0fea86d224a58f0b86011a39af1297334f647",
  "verified_target": {
    "full_path": "hott/test",
    "id": 123,
    "kind": "project",
    "web_url": "https://gitlab.dcloud.run/hott/test"
  }
}
