{
  "captured_at": "2026-10-04T02:10:29.118059+00:00",
  "cleanup": {
    "status": "NOT_APPLICABLE"
  },
  "credential_digest": "sha256:b27033322a421fcdbf7c8a2f5347a34715a37b1798c3bda1cf1dd39e781909a3",
  "credential_source": "file:path:2ccda27d0866",
  "errors": [],
  "execution_host": "mac.lan",
  "identity": {
    "id": 6,
    "username": "spyroot",
    "web_url": "https://gitlab.dcloud.run/spyroot"
  },
  "kind": "gitlab_wiki",
  "mutated": false,
  "operation": "create",
  "origin": "https://gitlab.dcloud.run",
  "phase": "APPLY",
  "plan": {
    "body_sha256": "6638c4c8d596a0d912750d9a6bf9d5b7df99ae6125ecb7475966a082096bbb85",
    "confirmation_ready": true,
    "fields": [
      "content",
      "title"
    ],
    "one_time_sink_required": false,
    "operation": "create",
    "plan_digest": "4138fec2c68aabf74c8ef6cef8cbed0750f84de2eedcca67810debb6616d7f7c",
    "project_ids": null,
    "resource_id": null,
    "target_kind": "project",
    "target_reference": "hott/test"
  },
  "plan_digest": "4138fec2c68aabf74c8ef6cef8cbed0750f84de2eedcca67810debb6616d7f7c",
  "readback": {
    "action": "NO_OP",
    "slug": "HOTT-team-ci-skills-PR16-25cfdcf-wiki-verification-20261004",
    "verified": true
  },
  "records": [
    {
      "action": "NO_OP",
      "slug": "HOTT-team-ci-skills-PR16-25cfdcf-wiki-verification-20261004",
      "verified": true
    }
  ],
  "result_action": "NO_OP",
  "schema_version": "1.0",
  "skill": {
    "algorithm": "sha256-tree-v1",
    "consuming_project": {
      "commit": null,
      "source": null
    },
    "digest": "552c72f8be1a8986efa818b74842c7f435830a3911615e4dce49f1b200deb8d0",
    "file_count": 48,
    "revision": {
      "source": "git_head",
      "value": "25cfdcf92fbcbffec4943fca3e6e64ddeac67d2b",
      "verified": true
    }
  },
  "status": "PASS",
  "summary": {
    "error_count": 0,
    "record_count": 1
  },
  "target": {
    "kind": "project",
    "reference": "hott/test"
  },
  "target_file": "path:5e5380df1eda",
  "target_source": "argv:--target;argv:--project",
  "tested_revision": null,
  "verified_target": {
    "full_path": "hott/test",
    "id": 123,
    "kind": "project",
    "web_url": "https://gitlab.dcloud.run/hott/test"
  }
}
