{
  "captured_at": "2026-10-18T12:40:53.982632+00:00",
  "cleanup": {
    "status": "NOT_APPLICABLE"
  },
  "credential_digest": "sha256:b27033322a421fcdbf7c8a2f5347a34715a37b1798c3bda1cf1dd39e781909a3",
  "credential_source": "file:path:29f247d18d3c",
  "errors": [],
  "execution_host": "mac.lan",
  "identity": {
    "id": 6,
    "username": "spyroot",
    "web_url": "https://gitlab.dcloud.run/spyroot"
  },
  "kind": "gitlab_wiki",
  "mutated": false,
  "operation": "update",
  "origin": "https://gitlab.dcloud.run",
  "phase": "APPLY",
  "plan": {
    "body_sha256": "862e2d343954594614836d360cbcd18a758f2a55d0e6c55d1d127bdfaa6fbc69",
    "confirmation_ready": true,
    "fields": [
      "content"
    ],
    "one_time_sink_required": false,
    "operation": "update",
    "plan_digest": "f6d68b80461a31b5380cd7711f7c63b7e97d0ef58aeef519071877d893a65eeb",
    "project_ids": null,
    "resource_id": "ci-skills-adfdf07e-20261018T123816Z",
    "target_kind": "project",
    "target_reference": "hott/test"
  },
  "plan_digest": "f6d68b80461a31b5380cd7711f7c63b7e97d0ef58aeef519071877d893a65eeb",
  "readback": {
    "action": "NO_OP",
    "slug": "ci-skills-adfdf07e-20261018T123816Z",
    "verified": true
  },
  "records": [
    {
      "action": "NO_OP",
      "slug": "ci-skills-adfdf07e-20261018T123816Z",
      "verified": true
    }
  ],
  "result_action": "NO_OP",
  "schema_version": "1.0",
  "skill": {
    "algorithm": "sha256-tree-v1",
    "consuming_project": {
      "commit": null,
      "source": null
    },
    "digest": "63e228e1553fc2146726c56e358d1ccf1e8e8e6222e7a22179e0632c73c6c4fb",
    "file_count": 208,
    "functional_digest": "e24a667a3c38b4f68944b6a82cec11f7a101f6d31433947cdc4e68dd5e5eddc7",
    "revision": {
      "source": "installer_record",
      "value": "adfdf07eddd4825e1d5e1b7a0b49f5eb94205a09",
      "verified": true
    }
  },
  "status": "PASS",
  "summary": {
    "error_count": 0,
    "record_count": 1
  },
  "target": {
    "kind": "project",
    "reference": "hott/test"
  },
  "target_file": "path:8617612df58d",
  "target_source": "project;argv:--project",
  "tested_revision": "adfdf07eddd4825e1d5e1b7a0b49f5eb94205a09",
  "verified_target": {
    "full_path": "hott/test",
    "id": 123,
    "kind": "project",
    "web_url": "https://gitlab.dcloud.run/hott/test"
  }
}
